{
"$schema": "https://json-schema.org/draft/2020-12/schema",
"$id": "schemas/archive/conversation-archive-request.schema.json",
"title": "Conversation Archive Payload",
"description": "Public request schema for the archive_conversation workflow. This schema defines the archive payload accepted by the public workflow boundary and intentionally excludes private storage implementation details.",
"type": "object",
"additionalProperties": false,
"required": [
"conversation_id",
"conversation_title",
"project",
"extraction_type",
"start_time",
"end_time",
"message_count",
"messages"
],
"properties": {
"conversation_id": {
"type": "string",
"minLength": 1,
"description": "Stable identifier for the archived interaction."
},
"conversation_title": {
"type": "string",
"minLength": 1,
"description": "Human-readable title of the archived interaction."
},
"project": {
"type": "string",
"minLength": 1,
"description": "Project or workstream associated with the archived interaction."
},
"extraction_type": {
"type": "string",
"minLength": 1,
"description": "Type of archive extraction performed by the workflow."
},
"start_time": {
"type": "string",
"format": "date-time",
"description": "Start timestamp of the archived interaction scope."
},
"end_time": {
"type": "string",
"format": "date-time",
"description": "End timestamp of the archived interaction scope."
},
"message_count": {
"type": "integer",
"minimum": 1,
"description": "Number of messages included in the archived interaction."
},
"messages": {
"type": "array",
"minItems": 1,
"description": "Ordered message list captured from the interaction.",
"items": {
"$ref": "./message.schema.json"
}
},
"source": {
"type": "string",
"minLength": 1,
"description": "Optional public source category, such as chat or workflow."
},
"source_platform": {
"type": "string",
"minLength": 1,
"description": "Optional public platform label for the originating client."
}
}
}
