{
  "conversation_id": "2026-06-17_1600_weft_public-summary",
  "conversation_title": "Public Summary — Weft",
  "project": "Weft",
  "extraction_type": "full_message_archive",
  "start_time": "2026-06-17T16:00:00+02:00",
  "end_time": "2026-06-17T16:00:00+02:00",
  "message_count": 1,
  "messages": [
    {
      "role": "user",
      "content": "# Public Summary — Weft\n\n## What Weft is\n\nWeft is an archive-first context and knowledge infrastructure project for AI-assisted workflows.\n\nIt is designed to turn temporary AI interactions, workflow outputs, and project decisions into structured, searchable, project-linked records that can be retrieved later to support continuity across sessions, tools, and models.\n\nWeft is not a chatbot, Notion template, or Make tutorial. It is a system architecture project focused on persistent context, deterministic workflow behavior, and controlled knowledge capture.\n\n## Problem it solves\n\nAI-assisted work often breaks down when useful context remains trapped inside temporary conversations, disconnected notes, or tool-specific outputs.\n\nThis creates recurring problems:\n\n* important decisions are hard to find later\n* context must be manually reconstructed\n* project continuity depends on memory or copy-paste\n* workflow outputs are difficult to audit or reuse\n* AI sessions become temporary instead of cumulative\n\nWeft addresses this by treating relevant interactions as structured records that can be archived, searched, linked to projects, and reconstructed into usable working context.\n\n## Why archive-first context matters\n\nArchive-first design separates persistent knowledge from temporary runtime interaction.\n\nInstead of relying on a single chat session or AI client as the source of truth, Weft stores meaningful workflow state outside the conversation. This makes context reusable across different tools, sessions, and models.\n\nThe core principle is simple:\n\ntemporary interaction should not be the system of record.\n\nPersistent context belongs in an external archive where it can be structured, inspected, searched, and retrieved deliberately.\n\n## What the system demonstrates technically\n\nWeft demonstrates practical system design across several areas:\n\n* archive-first architecture\n* deterministic workflow design\n* idempotent record handling through stable conversation identifiers\n* contract-based data modeling with JSON Schemas\n* separation between data, context, and orchestration layers\n* structured metadata for search and retrieval\n* operational evidence through safe run-history screenshots\n* privacy-conscious publication through public-safe examples and controlled evidence\n* explicit exclusion of live payloads, raw archived content, internal mappings, and private workflow data\n\nThe project shows how AI workflows can be made more reliable by combining structured contracts, persistent storage, retrieval boundaries, and observable execution.\n\n## What it shows about the builder’s working style\n\nThis project demonstrates a working style focused on:\n\n* architecture before tooling\n* deterministic behavior over fragile automation\n* explicit contracts over implicit assumptions\n* persistent context over temporary chat history\n* observability over invisible workflow state\n* privacy-aware publication\n* clear documentation of trade-offs and boundaries\n\nThe emphasis is not on exposing every implementation detail, but on showing that the system can be explained, inspected, tested, and safely presented.\n\n## Relevant roles and teams\n\nWeft is relevant for teams working on:\n\n* AI workflow automation\n* internal AI productivity systems\n* knowledge management infrastructure\n* agentic workflow design\n* automation governance\n* context engineering\n* operational tooling for AI-assisted work\n* Make, Notion, GitHub, and MCP-oriented workflows\n\nIt is especially relevant in environments where AI-generated work needs to remain traceable, reusable, and portable across tools."
    }
  ],
  "source": "chat",
  "source_platform": "ChatGPT"
}